title,tema,dificuldade,definicao,fisiopatologia,sinais_sintomas,diagnostico,conduta,tratamento,pegadinhas,resumo,fluxograma,algoritmo,score_clinico,sinais_gravidade,criterios_internacao,erros_comuns,dica_tep,checklist,flashcards,mini_aula,simulado

RN prematuro com SDR,Neonatologia,5,"SDR neonatal causada por deficiência de surfactante.","Atelectasia alveolar e redução da complacência pulmonar.","Taquipneia; gemência; retrações; hipoxemia.","Clínica + RX em vidro fosco.","CPAP precoce.","Surfactante + suporte ventilatório.","TEP diferencia SDR de TTN.","Prematuro + desconforto respiratório progressivo.","Prematuro → desconforto → CPAP → surfactante.","SatO2 → CPAP → surfactante.","Silverman-Andersen.","Apneia; hipoxemia; exaustão.","Necessidade de O2; esforço intenso.","Atrasar CPAP.","Prematuridade é palavra-chave.","☑ Prematuridade ☑ Gemência ☑ RX vidro fosco","Qual principal causa da SDR?::Deficiência de surfactante","Mini aula SDR neonatal.","RN 30 semanas com Sat 86%."

Sepse neonatal precoce,Neonatologia,5,"Infecção neonatal nas primeiras 72h.","Transmissão vertical bacteriana.","Instabilidade térmica; letargia; desconforto respiratório.","Hemocultura + clínica.","Internação imediata.","Ampicilina + gentamicina.","RN pode ter sinais inespecíficos.","Sepse neonatal é emergência.","RN febril → culturas → antibiótico.","Culturas → ATB.","Rodwell.","Má perfusão; apneia.","Todos RN graves.","Esperar febre alta.","RN grave pode não ter febre.","☑ Letargia ☑ Hipotermia ☑ Apneia","Primeiro ATB na sepse neonatal?::Ampicilina + gentamicina","Mini aula sepse neonatal.","RN hipotérmico e hipoativo."

Hipoglicemia neonatal,Neonatologia,4,"Queda da glicemia neonatal.","Baixa reserva glicogênica.","Tremores; cianose; convulsão.","Glicemia capilar.","Correção imediata.","Glicose EV.","Prematuros têm maior risco.","Hipoglicemia pode causar lesão neurológica.","Sintomas → glicemia → corrigir.","Confirmar → glicose.","—","Convulsão; coma.","Hipoglicemia persistente.","Demorar correção.","TEP cobra filhos de mãe diabética.","☑ Tremores ☑ Convulsão ☑ Prematuridade","Valor clássico de hipoglicemia neonatal?::<45","Mini aula hipoglicemia.","RN tremendo após parto."

Reanimação neonatal,Neonatologia,5,"Suporte imediato ao RN na sala de parto.","Hipóxia neonatal.","Apneia; bradicardia; má perfusão.","Clínico.","Ventilação é prioridade.","VPP + compressões se necessário.","Ventilação é o passo mais importante.","A maioria melhora com ventilação.","RN nasce → avaliar respiração.","Ventilar → reavaliar FC.","Apgar.","FC <60.","Necessidade de VPP.","Intubar precocemente sem indicação.","Ventilação salva mais que massagem.","☑ FC ☑ Respiração ☑ Tônus","Primeiro passo na reanimação?::Ventilação","Mini aula reanimação.","RN apneico ao nascer."

Icterícia neonatal,Neonatologia,4,"Elevação da bilirrubina neonatal.","Imaturidade hepática.","Pele amarelada.","Bilirrubina sérica.","Avaliar zona de Kramer.","Fototerapia.","Icterícia precoce é mais grave.","Bilirrubina indireta predominante.","RN ictérico → dosar bilirrubina.","Kramer → bilirrubina.","Bhutani.","Letargia; encefalopatia.","BT elevada.","Ignorar icterícia precoce.","<24h sempre preocupa.","☑ Kramer ☑ Bilirrubina ☑ Fototerapia","Principal tratamento?::Fototerapia","Mini aula icterícia.","RN amarelado com 18h."

Choque séptico,Emergência,5,"Hipoperfusão sistêmica secundária à sepse.","Vasodilatação e disfunção circulatória.","TEC aumentado; taquicardia.","Clínico.","Expansão volêmica rápida.","Cristaloide + antibiótico.","Hipotensão é tardia.","Reconhecimento precoce salva vidas.","Perfusão ruim → bolus → reavaliar.","Perfusão → volume → vasoativo.","PELOD.","Oligúria; alteração mental.","Necessidade de vasoativo.","Esperar hipotensão.","Choque frio é clássico pediátrico.","☑ TEC ↑ ☑ Taquicardia ☑ Oligúria","Primeiro sinal do choque?::Taquicardia","Mini aula choque.","Lactente frio e mal perfundido."

Asma grave,Pneumologia,5,"Exacerbação grave da asma.","Broncoespasmo intenso.","Sibilância; tiragem; hipoxemia.","Clínico.","Broncodilatador imediato.","Salbutamol + corticoide.","Silêncio auscultatório é gravidade.","Asma grave pode evoluir rápido.","Dispneia → salbutamol → reavaliar.","Avaliar resposta.","PRAM.","Exaustão.","Hipoxemia persistente.","Subestimar esforço respiratório.","TEP cobra magnésio.","☑ Sibilância ☑ Tiragem ☑ Sat baixa","Conduta inicial?::Salbutamol","Mini aula asma.","Escolar dispneico."

Cetoacidose diabética,Endocrinologia,5,"Complicação aguda do DM1.","Deficiência de insulina.","Poliúria; vômitos; Kussmaul.","Gasometria + glicemia.","Hidratação cautelosa.","Insulina EV.","Edema cerebral é complicação grave.","Reposição rápida pode piorar edema.","Hiperglicemia → hidratar → insulina.","Hidratar → insulina.","—","Alteração neurológica.","CAD moderada/grave.","Bicarbonato desnecessário.","TEP ama edema cerebral.","☑ Kussmaul ☑ Hiperglicemia ☑ Desidratação","Complicação mais temida?::Edema cerebral","Mini aula CAD.","Adolescente com Kussmaul."

Convulsão febril,Neurologia,3,"Convulsão associada à febre.","Imaturidade cerebral.","Crise tônico-clônica.","Clínico.","Controlar febre.","Suporte.","Convulsão simples dura <15min.","Maioria benigna.","Febre → crise → recuperação.","Avaliar sinais meníngeos.","—","Focalidade.","Convulsão complexa.","Excesso de exames.","Convulsão simples é benigna.","☑ Febre ☑ Crise curta ☑ Recuperação","Duração típica?::<15 minutos","Mini aula convulsão febril.","Lactente febril convulsionando."

Meningite bacteriana,Infectologia,5,"Infecção bacteriana do SNC.","Inflamação meníngea.","Febre; vômitos; rigidez nuca.","Punção lombar.","Antibiótico precoce.","Ceftriaxona + vancomicina.","Não atrasar antibiótico.","Meningococcemia pode matar rapidamente.","Febre → PL → antibiótico.","PL → ceftriaxona.","Glasgow.","Choque; petéquias.","Alteração consciência.","Esperar exames.","Petéquias = alerta.","☑ Rigidez nuca ☑ Petéquias ☑ Febre","ATB inicial?::Ceftriaxona","Mini aula meningite.","Escolar febril com petéquias."

Desidratação grave,Gastroenterologia,4,"Perda hídrica importante.","Hipovolemia.","Olhos fundos; letargia.","Clínico.","Expansão rápida.","SF 20ml/kg.","TEC e pulsos são essenciais.","Choque hipovolêmico pode ocorrer.","Desidratação → expansão.","Avaliar perfusão.","—","Choque.","Má perfusão.","Subestimar perfusão.","TEP cobra TEC.","☑ Olhos fundos ☑ Letargia ☑ TEC ↑","Primeiro passo?::SF 20ml/kg","Mini aula desidratação.","Lactente diarreico letárgico."