title,tema,dificuldade,definicao,fisiopatologia,fatores_risco,sinais_sintomas,diagnostico,conduta,tratamento,medicacoes_doses,diagnosticos_diferenciais,nivel_risco,palavras_chave_clinicas,conduta_emergencia,sinais_gravidade,criterios_internacao,criterios_uti,erros_comuns,pegadinhas,dica_tep,resumo,fluxograma,algoritmo,tabela_resumo,score_clinico,checklist,mini_aula,fontes
RN com SDR,Neonatologia,5,"Sindrome do desconforto respiratorio neonatal por deficiencia primaria ou relativa de surfactante, classica do prematuro, com inicio nas primeiras horas de vida e tendencia a piora progressiva se nao houver suporte adequado.","A deficiencia de surfactante aumenta a tensao superficial alveolar, gera atelectasias difusas, baixa complacencia, hipoxemia, aumento do trabalho respiratorio e risco de fadiga. A prematuridade, diabetes materno, cesarea sem trabalho de parto e sexo masculino aumentam risco. O manejo moderno tenta evitar volutrauma/barotrauma com CPAP precoce, oxigenio titulado e surfactante seletivo.","Prematuridade, especialmente <34 semanas; ausencia de corticoide antenatal; diabetes materno; cesarea eletiva; sexo masculino; asfixia perinatal; gestacao multipla; historia previa de SDR.","Taquipneia, gemencia expiratoria, retracoes, batimento de asa nasal, cianose, necessidade crescente de oxigenio, queda de saturacao, Silverman-Andersen elevado. Em prematuro extremo pode haver apneia e pouca expressao de esforco por fadiga.","Diagnostico clinico-radiologico. Avaliar idade gestacional, tempo de inicio, necessidade de O2/FiO2, gasometria se grave, glicemia, temperatura e infeccao associada. RX classico: baixo volume pulmonar, padrao reticulogranular/vidro fosco e broncogramas aereos. Ecografia pulmonar pode ajudar onde disponivel.","Manter normotermia, via aerea posicionada, monitorizacao cardiorrespiratoria, oximetria com alvos neonatais, glicemia e acesso venoso se instavel. Iniciar CPAP nasal precoce se desconforto moderado ou necessidade de O2. Evitar hiperoxia. Reavaliar trabalho respiratorio, FiO2, gasometria e perfusao. Acionar neonatologia/UTI neonatal se necessidade crescente de suporte.","CPAP precoce, suporte termico e nutricional, cafeina se apneia da prematuridade conforme protocolo, surfactante seletivo quando indicado e preferencialmente por tecnica menos invasiva se equipe treinada. Ventilacao mecanica se falha do suporte nao invasivo, apneia recorrente, acidose importante ou exaustao.","Surfactante conforme produto e protocolo local; poractante alfa costuma ser 200 mg/kg dose inicial, podendo repetir 100 mg/kg se necessario. Cafeina citrato: ataque 20 mg/kg, manutencao 5-10 mg/kg/dia. Oxigenio deve ser titulado por alvo de saturacao neonatal, nao por dose fixa. Confirmar peso, idade gestacional e protocolo institucional.","Taquipneia transitoria do RN, pneumonia neonatal, sepse neonatal, aspiracao meconial, hipertensao pulmonar persistente, cardiopatia congenita cianotica, pneumotorax, malformacao pulmonar.",Alto,"rn,prematuro,sdr,gemencia,retracao,sat baixa,hipoxemia,vidro fosco,broncograma,cpap,surfactante,lisa","ABCDE neonatal: aquecer, posicionar via aerea, monitorizar SatO2/FC, iniciar CPAP se respirando com esforco, titular O2, corrigir hipoglicemia/hipotermia, solicitar RX/gasometria conforme gravidade e chamar UTI neonatal se FiO2 crescente, apneia, acidose ou falha de CPAP.","Apneia, gemencia persistente, cianose, SatO2 baixa apesar de O2/CPAP, FiO2 crescente, acidose respiratoria, exaustao, hipotensao, necessidade de surfactante ou ventilacao invasiva.","Todo RN com suspeita de SDR clinicamente relevante deve permanecer internado para monitorizacao, suporte respiratorio e investigacao de diferenciais.","Prematuro com necessidade de CPAP, FiO2 crescente, surfactante, ventilacao mecanica, apneia recorrente, acidose, instabilidade termica/metabolica ou suspeita de sepse associada.","Atrasar CPAP, oferecer oxigenio livre sem pressao distensora em SDR moderada/grave, confundir melhora com reducao de esforco por fadiga, nao controlar temperatura, nao investigar sepse quando quadro nao e tipico.",TTN geralmente melhora em 24-72h e e mais comum em termo/cesarea; SDR do prematuro tende a piorar nas primeiras horas. Gemencia e uma tentativa de manter PEEP. RX pode demorar a ficar classico no inicio.,"TEP costuma cobrar prematuro + desconforto progressivo + RX em vidro fosco/broncogramas = SDR; conduta inicial e CPAP precoce, nao antibiotico isolado.","Prematuro com desconforto progressivo nas primeiras horas: pensar SDR, aquecer, monitorar, CPAP precoce, O2 titulado e surfactante se falha/FiO2 crescente.",Prematuro com desconforto -> avaliar FC/SatO2/temperatura/glicemia -> CPAP se respirando com esforco -> RX/gasometria se grave -> FiO2 crescente ou falha? -> surfactante/LISA se disponivel -> falha/apneia/acidose? -> VM/UTI neonatal.,"1. Reconhecer desconforto. 2. CPAP precoce se respiracao espontanea. 3. Titular O2 por alvo neonatal. 4. Reavaliar FiO2, Silverman e gasometria. 5. Surfactante se indicacao. 6. Ventilar se falha.","Achado-chave: prematuridade + desconforto progressivo. RX: vidro fosco/baixo volume/broncogramas. Tratamento: CPAP, surfactante seletivo, evitar hiperoxia. Gravidade: apneia, acidose, FiO2 crescente.","Silverman-Andersen para desconforto respiratorio neonatal; usar tendencia e contexto, nao isoladamente.",Confirmar IG e peso | Aquecer | Oximetria/FC | Glicemia | CPAP se indicado | RX se necessario | Avaliar sepse/diferenciais | Considerar surfactante | Definir UTI/transporte seguro,A SDR neonatal e uma doenca de volume pulmonar baixo por falta de surfactante. A intervencao que muda a historia inicial e manter alveolos abertos com CPAP precoce e evitar tanto hipoxemia quanto hiperoxia. Surfactante entra quando o CPAP nao basta ou a necessidade de oxigenio sobe.,European Consensus Guidelines on RDS 2022: https://pmc.ncbi.nlm.nih.gov/articles/PMC10064400/ | SBP Reanimacao RN <34 semanas Diretrizes 2022: https://www.sbp.com.br/fileadmin/user_upload/sbp/2022/junho/06/DiretrizesSBP-Reanimacao-RNmenor34semanas-MAIO2022a.pdf
Sepse neonatal precoce,Neonatologia,5,"Infeccao bacteriana sistemica suspeita ou confirmada nas primeiras 72 horas de vida, geralmente relacionada a transmissao vertical, colonizacao materna por Streptococcus do grupo B, E. coli, corioamnionite ou rotura prolongada de membranas.","O RN tem resposta imune imatura e pode evoluir rapidamente para disfuncao respiratoria, circulatoria, metabolica ou neurologica. A apresentacao e frequentemente inespecifica; febre pode faltar e hipotermia pode ser o sinal mais importante.","Febre intraparto, corioamnionite/suspeita de infeccao intra-amniotica, GBS materno positivo sem profilaxia adequada, rotura de membranas prolongada, prematuridade, baixo peso, taquicardia fetal, liquido amniotico fétido.","Instabilidade termica, hipoatividade, irritabilidade, recusa alimentar, gemencia, desconforto respiratorio, apneia, taquicardia ou bradicardia, ma perfusao, palidez, distensao abdominal, convulsao.","Clinico e laboratorial. Hemocultura antes do antibiotico se nao atrasar tratamento; hemograma/PCR/procalcitonina ajudam na tendencia, mas nao excluem sepse isoladamente. Considerar gasometria, lactato, glicemia, eletrólitos, RX se respiratorio e liquor se suspeita meningite/estabilidade permitir.","RN sintomatico e emergencia: monitorizar, aquecer, avaliar glicemia/perfusao/respiracao, acesso venoso, coletar culturas sem atrasar antibiotico e iniciar antimicrobiano empirico. Reavaliar em serie e ajustar conforme culturas, foco e evolucao.","Antibioticoterapia empirica neonatal, suporte respiratorio/hemodinamico, expansao se choque, controle glicemico/termico e UTI se instavel. Suspender ou estreitar antibiotico quando culturas e evolucao sustentam baixa probabilidade, conforme protocolo.","Esquema classico: ampicilina + gentamicina. Ampicilina frequentemente 50 mg/kg/dose IV; gentamicina 4-5 mg/kg/dose com intervalo ajustado por idade gestacional, idade pos-natal e funcao renal. Meningite muda doses/esquema. Confirmar tabela neonatal local.","SDR, TTN, pneumonia neonatal, hipoglicemia, erro inato do metabolismo, cardiopatia congenita, hemorragia intracraniana, enterocolite necrosante, abstinencia neonatal.",Alto,"rn,sepse neonatal,hipotermia,febre materna,corioamnionite,rotura prolongada,apneia,letargia,ma perfusao,gbS","Se RN instavel: ABC, temperatura, glicemia, perfusao, acesso venoso/IO, hemocultura se possivel, antibiotico imediato, suporte ventilatorio e volume/vasoativo se choque. Nao esperar hemograma para tratar RN sintomatico.","Apneia, choque, convulsao, ma perfusao, hipotensao, acidose, hipoglicemia persistente, necessidade de ventilacao, hipoatividade importante.",Todo RN sintomatico com suspeita de sepse; RN assintomatico com fatores de risco relevantes conforme protocolo de observacao/investigacao local.,"Instabilidade respiratoria ou hemodinamica, apneia recorrente, choque, convulsao, acidose, necessidade de ventilacao, prematuridade importante ou suspeita de meningite grave.","Aguardar febre, usar hemograma normal para excluir sepse, atrasar antibiotico por coleta dificil, nao colher cultura quando viavel, esquecer hipoglicemia/hipotermia como sinais.",Sepse neonatal pode se apresentar como desconforto respiratorio isolado. Hipotermia e tao relevante quanto febre. Prematuro pode parecer pouco sintomatico ate descompensar.,RN + sinal inespecifico + fator de risco materno = pense sepse. Conduta em sintomatico: culturas se possivel e antibiotico EV precoce.,"Sepse neonatal precoce e diagnostico de risco: sinais podem ser sutis, mas a evolucao e rapida. Trate RN sintomatico antes de esperar exames perfeitos.",Fator de risco ou sintomas -> avaliar estabilidade -> sintomatico/instavel? -> culturas se nao atrasar + ATB EV + suporte -> reavaliar 24-48h com culturas/labs/evolucao -> ajustar/suspender conforme protocolo.,1. Reconhecer sinais inespecificos. 2. Classificar estabilidade. 3. Coletar hemocultura se possivel. 4. Iniciar ATB empirico. 5. Suporte ABC/glicose/temperatura. 6. Reavaliar culturas e clinica.,"Periodo: <72h. Germes classicos: GBS/E. coli. Sinais: hipotermia, apneia, letargia, ma perfusao. Tratamento: ampicilina + gentamicina ajustadas. Erro: esperar febre.","Usar protocolos locais de risco neonatal; calculadoras de risco podem auxiliar em RN termo/tardio bem, mas nao substituem julgamento em RN sintomatico.",Temperatura | Glicemia | Perfusao | Respiracao | Hemocultura se possivel | ATB precoce | Avaliar liquor se indicado | Monitorar diurese | Reavaliar culturas em 24-48h,"O ponto central da sepse neonatal e que o RN nao faz semiologia exuberante. Instabilidade termica, recusa alimentar e apneia podem ser a sepse. Exames ajudam, mas a decisao inicial e clinica quando ha sintomas.",NICE Neonatal infection NG195: https://www.nice.org.uk/guidance/ng195/chapter/Recommendations | SBP Programa de Reanimacao Neonatal Diretrizes 2022: https://www.sbp.com.br/fileadmin/user_upload/sbp/2022/maio/20/DiretrizesSBP-Reanimacao-RNigualMaior34semanas-MAIO2022.pdf
Reanimação neonatal,Neonatologia,5,"Conjunto de intervencoes realizadas em sala de parto para apoiar a transicao cardiorrespiratoria do recem-nascido, priorizando aquecimento, posicionamento e ventilacao efetiva quando necessaria.","Na maioria dos RN que precisam de reanimacao, a bradicardia decorre de hipoxemia e ventilacao inadequada. Por isso, a intervencao mais importante e ventilacao com pressao positiva efetiva, antes de compressao ou medicamentos.","Prematuridade, liquido meconial com RN nao vigoroso, asfixia, cesarea de urgencia, descolamento de placenta, prolapso de cordao, uso materno de opioides/sedativos, malformacoes, gestacao multipla, infeccao.","Apneia, gasping, choro ausente, baixo tonus, cianose persistente, FC <100 bpm, FC <60 bpm apesar de ventilacao efetiva, saturacao abaixo do esperado para minuto de vida.","Avaliacao imediata ao nascer: gestacao a termo? respirando ou chorando? bom tonus? Depois monitorar FC, respiracao e oximetria pre-ductal se reanimacao. Apgar e registro de resposta, nao criterio para iniciar manobras.","Preparar equipe/material antes do parto de risco. Ao nascer: aquecer, posicionar cabeca, aspirar apenas se obstrucao, secar/estimular e avaliar respiracao/FC. Se apneia/gasping ou FC <100, iniciar VPP. Se FC <60 apos VPP efetiva, iniciar compressões coordenadas e escalar.","VPP com mascara/canula conforme necessidade, correcao de tecnica (MR SOPA ou equivalente), intubacao se VPP inefetiva/prolongada ou indicacao especifica, compressões 3:1 se FC <60 apos ventilacao efetiva, adrenalina IV/IO se FC persiste <60 apesar de ventilacao e compressões adequadas.","Adrenalina IV/IO 0,01-0,03 mg/kg da solucao 0,1 mg/mL (1:10.000), equivalente a 0,1-0,3 mL/kg. Expansor cristaloide 10 mL/kg se suspeita de hipovolemia/choque. Ventilacao 40-60/min; compressao:ventilacao 3:1. Confirmar diretriz SBP/NRP local.","Depressao por drogas maternas, malformacao de via aerea, pneumotorax, hernia diafragmatica, cardiopatia congenita, hipovolemia, sepse precoce, prematuridade extrema.",Alto,"nascimento,rn,apneia,gasping,fc baixa,bradicardia,vpp,compressao,adrenalina,reanimacao neonatal","Se RN apneico/gasping ou FC <100 apos passos iniciais: VPP imediata e checar expansao toracica. Se FC nao sobe, corrigir tecnica. Se FC <60 apos VPP efetiva, compressões 3:1 com O2 adequado e considerar via aerea avancada/adrenalina.","FC <60, apneia persistente, ausencia de expansao toracica com VPP, necessidade de compressões, necessidade de adrenalina, cianose/hipoxemia persistente, choque/hipovolemia.","RN que necessitou VPP alem de passos iniciais, compressões, medicacao, oxigenio prolongado, suspeita de asfixia, prematuridade ou instabilidade deve ser observado/internado conforme protocolo.","Compressões, adrenalina, intubacao, ventilacao prolongada, acidose/asfixia, convulsao, encefalopatia, prematuridade importante ou necessidade de suporte respiratorio continuo.","Usar Apgar para decidir inicio, atrasar VPP, nao checar expansao toracica, comprimir antes de ventilar bem, aspirar rotineiramente sem obstrucao, esquecer preparo antes do parto.",Bradicardia neonatal geralmente e problema ventilatorio. A manobra que salva e VPP efetiva. Liquido meconial nao indica aspiracao traqueal rotineira se RN esta vigoroso.,"Pergunta classica: RN apneico com FC 80 apos passos iniciais = VPP, nao compressao.","Reanimacao neonatal e algoritmo ventilatorio: aquecer, posicionar, estimular, avaliar FC/respiracao e iniciar VPP quando indicado.",Nasceu -> termo/respira/tonus? se sim cuidados de rotina; se nao -> aquecer/posicionar/secar/estimular -> FC/respiracao -> FC <100 ou apneia? VPP -> FC <60 apos VPP efetiva? compressões 3:1 -> persiste? adrenalina IV/IO.,1. Preparar. 2. Passos iniciais. 3. VPP se apneia/gasping/FC <100. 4. Corrigir VPP se sem resposta. 5. Compressões se FC <60. 6. Adrenalina se refratario.,Decisor principal: FC. VPP: FC <100/apneia/gasping. Compressões: FC <60 apos VPP efetiva. Relacao: 3:1. Medicacao: adrenalina se refratario.,"Apgar registra resposta em 1/5/10 min, mas nao deve atrasar intervencoes.",Equipe avisada | Calor ligado | Mascara/tamanho | Blender/O2/ar | Aspirador se obstrucao | Oximetro pre-ductal | Avaliar FC | VPP com expansao toracica | Escalar se FC <60,"A logica e simples: sem ventilacao, nao ha reversao da bradicardia neonatal. Antes de pensar em droga, garanta que o ar esta entrando: selo da mascara, posicao, pressao, via aerea e expansao toracica.",SBP Programa de Reanimacao Neonatal Diretrizes 2022: https://www.sbp.com.br/fileadmin/user_upload/sbp/2022/maio/20/DiretrizesSBP-Reanimacao-RNigualMaior34semanas-MAIO2022.pdf | SBP Reanimacao RN <34 semanas Diretrizes 2022: https://www.sbp.com.br/fileadmin/user_upload/sbp/2022/junho/06/DiretrizesSBP-Reanimacao-RNmenor34semanas-MAIO2022a.pdf
Icterícia neonatal,Neonatologia,4,"Coloracao amarelada por hiperbilirrubinemia no periodo neonatal. Pode ser fisiologica, mas inicio precoce, niveis elevados, progressao rapida ou bilirrubina direta aumentada exigem investigacao e tratamento.","O RN tem maior producao de bilirrubina, menor conjugacao hepatica e circulacao entero-hepatica aumentada. Bilirrubina indireta muito elevada pode atravessar barreira hematoencefalica e causar encefalopatia bilirrubinica/kernicterus, especialmente com fatores de neurotoxicidade.","Ictericia <24h, prematuridade/IG menor, incompatibilidade ABO/Rh ou DAT positivo, G6PD, cefalo-hematoma/equimoses, aleitamento com baixa ingesta/perda ponderal, irmao que precisou fototerapia, sepse, hipoalbuminemia.","Ictericia cefalocaudal, escleras amareladas, sonolencia, sucção ruim, perda ponderal. Sinais neurologicos de alarme: letargia, hipotonia ou hipertonia, choro agudo, febre, opistotono, convulsoes.","Dosar bilirrubina total e fracoes quando indicado e interpretar por idade em horas, idade gestacional e fatores de risco. TcB pode rastrear, mas valores proximos ao limiar ou altos exigem bilirrubina serica. Avaliar grupo/Rh, DAT, hemograma/reticulocitos, G6PD e infeccao se suspeita.",Identificar idade em horas e fatores de risco; plotar em curva atualizada; iniciar fototerapia se atingir limiar; garantir alimentacao/hidratacao; investigar hemolise ou colestase. Bilirrubina direta elevada nao e tratada com fototerapia como problema principal: investigar colestase.,"Fototerapia intensiva conforme limiar, imunoglobulina em hemolise isoimune selecionada conforme protocolo, exsanguineotransfusao se limiar critico ou encefalopatia. Seguimento pos-alta depende da distancia ate o limiar e risco.","Fototerapia nao tem dose por kg; exige irradiancia/area corporal adequadas e protecao ocular. IVIG em doenca hemolitica isoimune pode ser 0,5-1 g/kg conforme protocolo quando BT sobe apesar de fototerapia intensiva. Exsanguineotransfusao e procedimento de UTI neonatal.","Ictericia fisiologica, hemolise ABO/Rh, deficiencia G6PD, sepse, policitemia, equimoses/cefalo-hematoma, baixa ingesta, hipotireoidismo, atresia biliar/colestase se direta elevada.",Moderado/Alto,"rn,ictericia,bilirrubina,fototerapia,menos de 24 horas,hemolise,g6pd,kernicterus,colestase,bilirrubina direta","Ictericia <24h, sinais neurologicos ou BT proxima/acima de limiar: dosar BT/frações imediatamente, iniciar fototerapia intensiva se indicado, avaliar hemolise e acionar neonatologia. Nao dar alta sem plano de reavaliacao.","Ictericia nas primeiras 24h, subida rapida, BT em limiar alto, sinais neurologicos, prematuridade, DAT positivo/hemolise, sepse, bilirrubina direta elevada, falha de fototerapia.","Necessidade de fototerapia, investigacao de ictericia precoce/patologica, baixa ingesta/desidratacao, hemolise, risco social de seguimento inadequado.","Limiar de escalonamento/exsanguineotransfusao, encefalopatia bilirrubinica, hemolise grave, instabilidade clinica, prematuridade importante.","Usar apenas Kramer para decidir, ignorar idade em horas, recomendar banho de sol, nao fracionar bilirrubina quando ictericia prolongada/colestase suspeita, subestimar ictericia <24h.","A conduta depende de idade em horas, IG e fatores de neurotoxicidade. AAP 2022 mudou limiares; usar calculadora/curva atualizada. Bilirrubina direta elevada sugere colestase, nao ictericia fisiologica.",Ictericia antes de 24h e patologica ate prova em contrario.,"Ictericia neonatal nao se maneja no olho: dose BT/frações e interprete por idade em horas, IG e risco.",RN ictérico -> idade em horas + IG + risco -> TcB/BT -> BT no limiar? fototerapia -> sinais neurologicos/limiar critico? escalonar/UTI -> direta alta? investigar colestase.,1. Determinar idade em horas. 2. Dosar BT/frações. 3. Plotar curva. 4. Fototerapia se limiar. 5. Investigar hemolise/sepse quando precoce. 6. Planejar controle pos-alta.,"Alarme: <24h, neurologico, subida rapida. Exame-chave: BT/frações. Tratamento: fototerapia por curva. Erro: banho de sol/Kramer isolado.",Curvas/limiares de fototerapia e exsanguineotransfusao por idade em horas; usar ferramenta atualizada e protocolo local.,Idade em horas | IG | Peso/perda | BT/frações | DAT/grupo se risco | G6PD se indicado | Curva atualizada | Fototerapia se limiar | Retorno programado,"A ictericia fisiologica existe, mas a prova e a seguranca do paciente dependem de reconhecer padroes patologicos: antes de 24h, hemolise, prematuridade e sinais neurologicos. A zona de Kramer nunca substitui bilirrubina quando ha risco.",AAP Hyperbilirubinemia Guideline 2022: https://publications.aap.org/pediatrics/article/150/3/e2022058859/188726/Clinical-Practice-Guideline-Revision-Management-of
Hipoglicemia neonatal,Neonatologia,4,"Baixa concentracao de glicose no periodo neonatal em RN sintomatico ou de risco, com limiares operacionais variando por idade de vida e protocolo. Sintomas neurologicos ou valores muito baixos exigem correcao imediata.","A transicao metabolica neonatal depende de glicogenolise, gliconeogenese, lipolise e alimentacao. Prematuros/PIG tem baixa reserva; filhos de mae diabetica/GIG podem ter hiperinsulinismo; sepse/asfixia aumentam consumo. Hipoglicemia prolongada ou sintomatica pode causar lesao neurologica.","Prematuro, PIG, GIG, filho de mae diabetica, asfixia, hipotermia, sepse, baixa ingesta, policitemia, doenca endocrina/metabolica, uso materno de beta-bloqueador.","Tremores, irritabilidade, letargia, hipotonia, choro fraco, dificuldade de sucção, apneia, cianose, hipotermia, convulsao. Pode ser assintomatica em RN de risco.","Triagem de glicemia em RN de risco e glicemia imediata em sintomaticos. Confirmar valor baixo com amostra laboratorial quando possivel, mas nao atrasar tratamento se sintomatico. Investigar hipoglicemia persistente/recorrente com amostra critica antes da correcao se seguro.","Se sintomatico: corrigir imediatamente com glicose EV e monitorar. Se assintomatico leve: alimentar precocemente, considerar gel de glicose 40% se protocolo, repetir glicemia. Manter temperatura e tratar causa associada.","Leite materno/oferta enteral se assintomatico e seguro; gel de glicose 40% em alguns protocolos; glicose EV se sintomatico, grave, persistente ou incapaz de alimentar. Ajustar taxa de infusao de glicose e investigar se necessidade alta/persistente.","Dextrose 10% EV 2 mL/kg em bolus para sintomatico/grave, seguido de infusao de D10 com taxa de glicose frequentemente 4-8 mg/kg/min, titulada por controles. Gel de glicose 40% costuma ser 0,5 mL/kg bucal em protocolos para assintomaticos. Evitar D25/D50 em neonatos.","Sepse, asfixia, hipotermia, hiperinsulinismo, insuficiencia adrenal/hipopituitarismo, erro inato do metabolismo, baixa ingesta, convulsao por outra causa.",Alto,"rn,hipoglicemia,glicemia baixa,tremores,convulsao,filho de mae diabetica,pig,gig,prematuro,dextrose 10","RN sintomatico: ABC, glicemia imediata, D10 EV 2 mL/kg, iniciar infusao, repetir glicemia em 15-30 min conforme protocolo, corrigir hipotermia e investigar sepse/asfixia.","Convulsao, apneia, letargia, glicemia muito baixa, recorrencia, necessidade de alta taxa de infusao, hepatomegalia, acidose, suspeita endocrino-metabolica.","RN sintomatico, necessidade de EV, hipoglicemia recorrente/persistente, fator de risco com controles instaveis, impossibilidade de alimentacao segura.","Convulsao, apneia, instabilidade, necessidade de acesso central/alta taxa de glicose, suspeita de hiperinsulinismo grave ou erro inato, sepse/asfixia associada.","Nao rastrear grupos de risco, atrasar correcao em sintomatico, usar solucoes hipertônicas inadequadas, parar infusao sem estabilidade alimentar, nao investigar recorrencia.","Tremor neonatal nem sempre e benigno; checar glicemia. Filho de mae diabetica pode fazer hipoglicemia nas primeiras horas por hiperinsulinismo. Sintoma manda tratar, mesmo enquanto confirma.",Prematuro/PIG/GIG/filho de mae diabetica = rastrear. Convulsao/tremor = glicemia na hora.,"Hipoglicemia neonatal e tempo-dependente: reconhecer risco, medir cedo e corrigir rapido se sintomatica.",RN de risco/sintomatico -> glicemia -> sintomatico ou valor grave? D10 EV + infusao -> assintomatico leve? alimentar/gel + repetir -> recorrente/persistente? investigar causa.,1. Identificar risco. 2. Medir. 3. Tratar sintomatico com D10 EV. 4. Repetir controle. 5. Manter oferta. 6. Investigar se persistente.,"Risco: PIG/GIG/prematuro/filho de mae diabetica. Sintomas: tremor, letargia, convulsao. Tratamento grave: D10 2 mL/kg + infusao.",Nao ha score unico; usar limiares operacionais por idade de vida e protocolo institucional.,Grupo de risco | Primeira glicemia no tempo correto | Alimentacao precoce | Sintomas? | D10 se indicado | Controle seriado | Temperatura | Investigar recorrencia,A hipoglicemia neonatal tem dois perigos: tratar demais transicoes normais e tratar de menos o RN sintomatico. O equilibrio vem de rastrear grupos certos e agir imediatamente quando ha sintomas ou persistencia.,AAP Postnatal Glucose Homeostasis 2011: https://publications.aap.org/pediatrics/article/127/3/e20103851/65026/Postnatal-Glucose-Homeostasis-in-Late-Preterm-and | Pediatric Endocrine Society persistent hypoglycemia 2015: https://pedsendo.org/clinical-resource/evaluation-and-management-of-persistent-hypoglycemia-in-neonates-infants-and-children-j-peds-2015/
