title,tema,dificuldade,definicao,fisiopatologia,fatores_risco,sinais_sintomas,diagnostico,conduta,tratamento,medicacoes_doses,diagnosticos_diferenciais,nivel_risco,palavras_chave_clinicas,conduta_emergencia,sinais_gravidade,criterios_internacao,criterios_uti,erros_comuns,pegadinhas,dica_tep,resumo,fluxograma,algoritmo,tabela_resumo,score_clinico,checklist,mini_aula,fontes
Prematuridade,Neonatologia,4,"Nascimento antes de 37 semanas completas, com risco proporcionalmente maior quanto menor a idade gestacional e o peso. O cuidado envolve respiracao, temperatura, glicose, nutricao, infeccao, neuroprotecao e seguimento.","A imaturidade pulmonar, neurologica, gastrointestinal, imunologica, renal, hepatica e metabolica reduz reservas e aumenta risco de SDR, apneia, hipotermia, hipoglicemia, sepse, enterocolite necrosante, hemorragia intracraniana e dificuldade alimentar.","Historia de prematuridade, gestacao multipla, infeccao materna, hipertensao/pre-eclampsia, diabetes, tabagismo, restricao de crescimento, rotura prematura de membranas, malformacoes, baixa assistencia prenatal.","Baixo peso, pele fina, hipotonia relativa, dificuldade de sucção, instabilidade termica, apneia, desconforto respiratorio, hipoglicemia, ictericia, intolerancia alimentar.","Classificar por idade gestacional e peso: prematuro extremo, muito prematuro, tardio; extremo baixo peso/muito baixo peso/baixo peso. Avaliar risco respiratorio, termico, metabolico, infeccioso, neurologico e nutricional.","Ambiente termico neutro, contato pele a pele quando seguro, suporte respiratorio conforme necessidade, rastreio de glicemia, prevencao de infeccao, leite humano prioritario, plano nutricional, vigilancia de apneia/ictericia e seguimento multiprofissional.","CPAP/suporte ventilatorio se indicado, cafeina para apneia da prematuridade, leite humano/fortificacao conforme peso/IG, nutricao parenteral em prematuros pequenos se necessario, vitamina D/ferro conforme idade/peso, imunizacoes e profilaxias conforme calendario e risco.","Cafeina citrato: ataque 20 mg/kg, manutencao 5-10 mg/kg/dia. Vitamina D frequentemente 400 UI/dia. Ferro enteral frequentemente 2-3 mg/kg/dia em prematuros quando indicado. Doses e inicio variam por peso, dieta, transfusoes e protocolo neonatal.","Restricao de crescimento em termo, baixo peso constitucional, doencas congenitas/metabolicas, infeccoes congenitas, sindromes geneticas.",Moderado/Alto,"prematuro,baixo peso,apneia,hipotermia,hipoglicemia,leite humano,ecn,cafeina,uti neonatal","Em prematuro instavel: aquecer com saco plastico/touca conforme IG, avaliar respiracao/FC, CPAP/VPP se indicado, glicemia, acesso venoso, prevenir hipotermia e transferir para unidade neonatal adequada.","IG muito baixa, peso <1500g, apneia, hipotermia, hipoglicemia, desconforto respiratorio, sepse suspeita, intolerancia alimentar, instabilidade hemodinamica.","Todo prematuro deve ter avaliacao hospitalar; prematuros tardios podem ir ao alojamento conjunto se estaveis, mas exigem vigilancia de alimentacao, temperatura, glicemia e ictericia.","Muito prematuro, extremo baixo peso, necessidade de suporte respiratorio, apneia, instabilidade termica/metabolica, infeccao suspeita, dificuldade alimentar significativa.","Subestimar prematuro tardio, nao monitorar glicemia/temperatura, atrasar leite humano, excesso de manipulacao, alta sem plano de peso/ictericia/alimentacao.","Prematuro tardio parece bem, mas descompensa por hipoglicemia, ictericia e falha alimentar. Leite humano reduz risco de enterocolite necrosante.","Prematuridade e matriz de varias questoes: SDR, apneia, hipoglicemia, hipotermia, ictericia e nutricao.","Cuidar do prematuro e prevenir complicacoes: calor, respiracao, glicose, leite humano, infeccao e seguimento.",Nasceu prematuro -> classificar IG/peso -> estabilidade respiratoria/termica/metabolica -> suporte conforme risco -> nutricao com leite humano -> monitorar apneia/glicemia/ictericia -> alta segura com seguimento.,1. Classificar IG/peso. 2. Aquecer. 3. Avaliar respiracao. 4. Glicemia. 5. Nutrir. 6. Prevenir infeccao/ECN. 7. Programar seguimento.,"Complicacoes: SDR, apneia, hipoglicemia, hipotermia, sepse, ECN. Protecao: calor, CPAP quando indicado, leite humano, cuidado minimo, seguimento.",Silverman se desconforto respiratorio; curvas de crescimento Fenton/Intergrowth para peso/IG; usar protocolo local.,IG/peso | Temperatura | Respiracao | Glicemia | Alimentacao | Ictericia | Cafeina se apneia | Leite humano | Vacinas/profilaxias | Seguimento,O prematuro nao e apenas um bebe pequeno. Cada sistema imaturo cria um risco previsivel; por isso o cuidado e antecipatorio. A prova costuma testar exatamente essa vigilancia preventiva.,European Consensus Guidelines on RDS 2022: https://pmc.ncbi.nlm.nih.gov/articles/PMC10064400/ | SBP Reanimacao RN <34 semanas Diretrizes 2022: https://www.sbp.com.br/fileadmin/user_upload/sbp/2022/junho/06/DiretrizesSBP-Reanimacao-RNmenor34semanas-MAIO2022a.pdf
Choque séptico,Emergência,5,"Sepse com disfuncao cardiovascular e hipoperfusao tecidual, podendo ocorrer com pressao arterial normal na crianca. Hipotensao e sinal tardio.","Inflamacao sistemica por infeccao leva a vasoplegia, disfuncao miocardica, extravasamento capilar, alteracao microcirculatoria e metabolismo anaerobio. Criancas compensam por taquicardia e vasoconstricao antes de hipotensao.","Lactentes, imunossupressao, asplenia/doenca falciforme, cateter, prematuridade, cardiopatia, doenca cronica, foco infeccioso grave, atraso no atendimento.","Febre ou hipotermia, taquicardia, taquipneia, TEC aumentado ou muito rapido com pulsos amplos, extremidades frias ou quentes, oliguria, alteracao mental, moteamento, hipotensao tardia.","Clinico: suspeita de infeccao + perfusao inadequada/disfuncao organica. Coletar culturas, lactato, gasometria, hemograma, eletrólitos, funcao renal/hepatica, glicemia e exames por foco, sem atrasar antibiotico/resuscitacao.","Reconhecer na triagem, monitorizar, oxigenio, dois acessos venosos ou intraosseo, culturas se nao atrasar, antibiotico precoce, fluidos em bolus pequenos com reavaliacao frequente e vasoativo precoce se choque refratario ou sinais de sobrecarga.","Cristaloide balanceado ou SF conforme disponibilidade; antibiotico amplo em ate 1 hora no choque; controle de foco; adrenalina/noradrenalina conforme perfil e protocolo; ventilacao, UTI e monitorizacao invasiva se necessario.","Cristaloide 10-20 mL/kg por bolus, reavaliando perfusao e sinais de sobrecarga; em ambiente com UTI pode chegar a 40-60 mL/kg na primeira hora se responsivo. Antibiotico empirico por foco. Vasoativos: adrenalina/noradrenalina em infusao titulada conforme protocolo. Nao atrasar vasoativo por falta de acesso central.","Desidratacao grave/choque hipovolemico, anafilaxia, choque cardiogenico/miocardite, arritmia, trauma/hemorragia, insuficiencia adrenal, CAD, intoxicacao.",Alto,"choque,sepse,tec aumentado,ma perfusao,extremidades frias,oliguria,taquicardia,lactato,hipotensao,vasoativo","ABCDE, oxigenio, monitor, glicemia, acesso IV/IO, culturas se possivel, antibiotico imediato, bolus 10-20 mL/kg com reavaliacao, iniciar vasoativo se refratario, chamar UTI. Se sinais de sobrecarga, parar volume e escalar vasoativo/ventilacao.","Alteracao mental, oliguria, TEC prolongado, pulsos fracos ou muito amplos, hipotensao, lactato elevado, acidose, necessidade de O2/ventilacao, purpura, choque refratario a volume.","Toda sepse com disfuncao organica, necessidade de antibiotico EV, monitorizacao ou foco grave.","Choque, necessidade de vasoativo, ventilacao, lactato/acidose persistente, hipotensao, oliguria, alteracao mental, falha de ressuscitacao inicial.","Esperar hipotensao, dar volume sem reavaliar, atrasar antibiotico, nao iniciar intraosseo, nao reconhecer sobrecarga, escolher antibiotico sem foco/risco local.","Crianca pode estar em choque com PA normal. TEC, estado mental e diurese valem mais que a PA isolada. Volume nao e infinito: reavaliar pulmoes, hepatomegalia e perfusao.",Lactente febril + TEC 5s + extremidades frias = choque compensado ate prova em contrario.,Choque septico pediatrico e diagnostico clinico de perfusao. Antibiotico e ressuscitacao sao tempo-dependentes.,Suspeita infeccao + ma perfusao -> ABC/monitor/acesso -> culturas se nao atrasar + ATB -> bolus 10-20 mL/kg/reavaliar -> refratario/sobrecarga? vasoativo -> UTI/controle de foco.,1. Triagem de sepse. 2. ABC e acesso. 3. Antibiotico rapido. 4. Fluido reavaliado. 5. Vasoativo precoce se refratario. 6. UTI e foco.,Sinal precoce: taquicardia/TEC. Sinal tardio: hipotensao. Tratamento: ATB + volume reavaliado + vasoativo. Erro: esperar PA cair.,"pSOFA/PELOD podem apoiar gravidade em UTI; na emergencia, perfusao clinica e resposta inicial guiam conduta.",Infeccao suspeita | FC/PA/TEC/mental/diurese | Glicemia | Lactato se disponivel | Culturas | ATB precoce | Bolus reavaliado | Vasoativo | UTI | Controle foco,"A crianca mantem pressao ate tarde. Quando a PA cai, a reserva acabou. O raciocinio correto e procurar hipoperfusao: TEC, pulso, pele, consciencia e urina. Trate antes da hipotensao.",Surviving Sepsis Campaign Pediatric Guidelines 2026: https://www.sccm.org/clinical-resources/guidelines/guidelines/surviving-sepsis-campaign-international-guidelines-for-the-management-of-sepsis-and-septic-shock-in
Asma grave,Emergência,5,"Exacerbacao asmatica com desconforto respiratorio importante, hipoxemia, fala limitada, uso de musculatura acessoria, resposta inadequada ao broncodilatador ou sinais de falencia respiratoria iminente.","Broncoconstricao, edema e inflamação de vias aereas causam aumento de resistencia, aprisionamento aereo, alteracao ventilacao/perfusao, hipoxemia e fadiga. Hipercapnia e silencio toracico sao sinais tardios e graves.","Internacao/UTI previa por asma, uso excessivo de SABA, baixa adesao a corticoide inalatorio, alergia alimentar/anafilaxia, infeccao viral, exposicao a fumaça, comorbidades, dificuldade de acesso a cuidado.","Dispneia, sibilancia, tiragem, taquipneia, fala entrecortada, agitacao ou sonolencia, SatO2 baixa, pico de fluxo reduzido quando mensuravel, pulso paradoxal. Silencio auscultatorio sugere fluxo muito baixo.","Clinico. Avaliar gravidade por fala, consciencia, FR, FC, SatO2, tiragem, ausculta e resposta inicial. RX so se febre persistente, assimetria, dor toracica, hipoxemia importante, suspeita de complicacao ou falha terapeutica.","Oxigenio se hipoxemia, SABA inalatorio repetido ou continuo, ipratropio na primeira hora se grave, corticoide sistemico precoce, reavaliacao frequente. Se grave/refrataria: sulfato de magnesio IV, suporte ventilatorio e UTI.","Salbutamol por MDI com espacador ou nebulizacao, ipratropio associado nos graves, prednisolona/dexametasona/metilprednisolona conforme protocolo, magnesio IV se resposta insuficiente, considerar VNI/intubacao por equipe experiente se falencia.","Salbutamol nebulizado 0,15 mg/kg/dose (min 2,5 mg; max 5 mg) a cada 20 min na primeira hora ou MDI 4-10 jatos com espacador. Ipratropio 250 mcg (<20 kg) ou 500 mcg (>20 kg) a cada 20 min por 3 doses. Prednisolona 1-2 mg/kg VO (max 40-50 mg) ou metilprednisolona 1-2 mg/kg IV. MgSO4 25-50 mg/kg IV em 20-30 min, max 2 g.","Bronquiolite, pneumonia, corpo estranho, anafilaxia, laringite, disfuncao de cordas vocais, insuficiencia cardiaca, pneumotorax, fibrose cistica.",Alto,"asma,sibilancia,tiragem,sat baixa,silencio toracico,hipoxemia,salbutamol,ipratropio,magnesio,broncoespasmo","SatO2/monitor, O2 para alvo adequado, salbutamol imediato, ipratropio se grave, corticoide cedo, reavaliar apos primeira hora. Sonolencia, silencio, exaustao ou Sat baixa persistente: magnesio, UTI e preparo para via aerea dificil.","SatO2 <=92%, fala impossivel, agitacao/sonolencia, exaustao, cianose, silencio toracico, bradicardia, hipercapnia, necessidade de SABA continuo, falha apos 1-2h.","Necessidade de O2, sintomas moderados/graves apos tratamento inicial, SABA mais frequente que 4/4h, fatores sociais/adesao, comorbidades, crise quase fatal previa.","Falha apos 1-2h de terapia intensiva, magnesio/bronchodilatador continuo, hipoxemia persistente, alteracao de consciencia, hipercapnia, exaustao, necessidade de VNI/intubacao.","Atrasar corticoide, subestimar silencio toracico, pedir RX de rotina e atrasar tratamento, nao usar espacador corretamente, alta sem plano de controle.","Menos sibilo pode ser piora quando ha pouca entrada de ar. Corticoide nao alivia imediatamente, mas reduz recaida e hospitalizacao. Ipratropio e para primeira hora nos graves, nao manutencao indefinida.","Crise grave refrataria: lembrar sulfato de magnesio. Silencio toracico = gravidade, nao melhora.","Asma grave e tratamento em ciclos: broncodilatar, reduzir inflamacao, oxigenar, reavaliar e escalar cedo se nao responder.",Dispneia/sibilancia -> gravidade/Sat -> SABA + O2 + corticoide -> grave? adicionar ipratropio -> reavaliar 1h -> falha/sinais de falencia? MgSO4 + UTI/suporte ventilatorio.,1. Avaliar gravidade. 2. O2 se hipoxemia. 3. SABA repetido. 4. Corticoide precoce. 5. Ipratropio se grave. 6. Magnesio/UTI se refrataria.,"Inicial: SABA + O2 + corticoide. Grave: ipratropio. Refrataria: MgSO4. Alarme: silencio, sonolencia, Sat baixa, exaustao.",PRAM pode classificar gravidade e resposta; usar junto com SatO2 e exame clinico.,SatO2 | Fala/consciencia | Tiragem | Ausculta | SABA | Corticoide | Ipratropio se grave | Reavaliar | MgSO4 se refrataria | Plano de alta/controle,"Na crise asmatica, o exame muda rapido. O tratamento nao termina na primeira nebulizacao: a decisao vem da resposta. Quem continua hipoxemico, cansado ou silencioso precisa escalar antes de parar.",Canadian Paediatric Society Acute Asthma 2021: https://cps.ca/en/documents/position/managing-an-acute-asthma-exacerbation | Ministerio da Saude Linha de Cuidado Asma: https://linhasdecuidado.saude.gov.br/portal/asma/unidade-hospitalar/avaliacao-conduta/
Cetoacidose diabética,Emergência,5,"Emergencia metabolica do diabetes caracterizada por hiperglicemia, cetose e acidose metabolica, geralmente por deficiencia absoluta ou relativa de insulina.","Deficiencia de insulina e aumento de hormonios contrarreguladores levam a hiperglicemia, diurese osmotica, desidratacao, lipolise, producao de corpos cetonicos e acidose. Edema cerebral/lesao cerebral associada a CAD e complicacao temida em pediatria.","DM1 novo, omissao de insulina, infeccao, falha de bomba, adolescencia, dificuldade psicossocial, historico de CAD, baixo acesso a insulina/monitorizacao.","Poliuria, polidipsia, perda ponderal, vomitos, dor abdominal, desidratacao, respiracao de Kussmaul, halito cetonico, letargia, confusao, choque em casos graves.","Glicemia elevada, cetonemia/cetonuria e acidose (pH venoso baixo e/ou bicarbonato reduzido). Dosar eletrólitos, ureia/creatinina, osmolaridade efetiva, gasometria, cetonas, ECG se K alterado e pesquisar gatilho infeccioso sem atrasar protocolo.","ABCDE, avaliar choque e consciencia, acesso venoso, monitorizacao, fluidos iniciais cautelosos, potassio antes/durante insulina conforme nivel e diurese, iniciar insulina EV sem bolus apos fase inicial, monitorar glicose/eletrólitos/neurologico.","Reposicao hidrica planejada, insulina regular EV continua, reposicao de potassio, adicionar dextrose quando glicose cair para manter clearance de cetose, tratar gatilho. Bicarbonato nao e rotina e pode aumentar risco, reservado para situacoes extremas/protocolo.","Se choque: cristaloide 10-20 mL/kg. Insulina regular EV 0,05-0,1 U/kg/h sem bolus, apos inicio de fluidos e K conhecido. Potassio geralmente 40 mmol/L no fluido quando diurese presente e K nao alto, conforme protocolo. Dextrose no fluido quando glicemia ~250-300 mg/dL ou queda rapida.","Gastroenterite, sepse, abdome agudo, intoxicacao, crise asmatica com acidose, erro inato do metabolismo, hiperglicemia de estresse, HHS.",Alto,"cad,diabetes,cetoacidose,kussmaul,cetonas,acidose,glicemia alta,vomitos,dor abdominal,edema cerebral,insulina ev","ABC, Glasgow, sinais de choque, glicemia/cetonas/gasometria/eletrólitos, SF/RL 10-20 mL/kg se choque ou desidratacao importante, monitorar K, iniciar insulina EV sem bolus apos fase inicial, vigilancia neurologica horaria.","Alteracao de consciencia, pH muito baixo, bicarbonato muito baixo, choque, hipocalemia/hipercalemia, lactente, ureia elevada, cefaleia, bradicardia, hipertensao, queda neurologica.",Toda CAD pediatrica deve internar para protocolo EV e monitorizacao.,"CAD grave, alteracao neurologica, choque, pH muito baixo, distúrbio de potassio, lactentes, necessidade de monitorizacao intensiva ou suspeita de edema cerebral.","Bolus de insulina, bicarbonato de rotina, esquecer potassio, corrigir glicose/osmolaridade rapido demais, nao monitorar neurologico, atribuir dor abdominal sempre a abdome cirurgico.","Dor abdominal e vomito podem ser CAD, nao gastroenterite. A primeira medida e fluido, nao insulina em bolus. Glicose cair nao significa CAD resolvida; precisa fechar anion gap/acidose/cetose.","CAD pediatrica: hidratar primeiro, insulina EV continua depois, vigiar potassio e edema cerebral.","CAD e protocolo: fluidos cautelosos, potassio, insulina sem bolus e vigilancia neurologica.",Hiperglicemia + cetose + acidose -> avaliar choque/mental -> fluidos -> K -> insulina EV -> adicionar dextrose quando glicose cai -> resolver cetose/acidose -> transicao SC com sobreposicao.,1. Confirmar CAD. 2. Classificar gravidade. 3. Fluido inicial. 4. Potassio. 5. Insulina EV. 6. Dextrose quando indicado. 7. Monitor neurologico.,Triade: hiperglicemia+cetose+acidose. Evitar: insulina bolus/bicarbonato rotina. Complicacao: edema cerebral. UTI: grave/neurologico/choque.,Gravidade por pH/bicarbonato; Glasgow e sinais de edema cerebral devem ser seriados.,Glicemia | Cetonas | Gasometria | Na/K corrigidos | Ureia/Cr | ECG se K | Fluido | K | Insulina sem bolus | Neurologico horario | Gatilho,"Na CAD, o paciente melhora quando a cetose resolve, nao apenas quando a glicose cai. Por isso se adiciona dextrose para continuar insulina com seguranca ate corrigir acidose e cetonas.",ISPAD DKA Guidelines 2022: https://www.ispad.org/static/6dd62eae-c8cb-4b4a-84e1efc768505746/Ch11PediatricDiabetes.pdf
Convulsão febril,Emergência,3,"Crise convulsiva associada a febre em crianca tipicamente entre 6 meses e 5 anos, sem infeccao do SNC, disturbio metabolico ou epilepsia previa. Pode ser simples ou complexa.",Predisposicao etaria e genetica associada a resposta cerebral imatura a febre/infeccoes comuns. A crise simples costuma ser benigna e autolimitada.,"Idade 6 meses-5 anos, historia familiar, febre alta ou subida rapida, infeccoes virais, vacinacao recente em alguns contextos, recorrencia previa.","Crise generalizada tonico-clonica durante febre, geralmente breve, com periodo pos-ictal curto. Forma simples: generalizada, <15 min, unica em 24h e neurologico normal. Complexa: focal, >=15 min, recorrente em 24h ou recuperacao anormal.","Clinico, apos excluir meningite/encefalite, disturbio metabolico e outra causa. Avaliar idade, duracao, focalidade, numero de crises, recuperacao, vacinas, antibiotico previo, sinais meningeos e foco infeccioso.","Durante crise: ABC, lateralizar, proteger, oxigenio se necessario, glicemia se prolongada/alteracao persistente. Se >5 min, benzodiazepinico. Depois, investigar causa da febre conforme clinica e orientar familia.","Convulsao ativa prolongada: benzodiazepinico. Antitermico para conforto, mas nao previne recorrencia de forma confiavel. Convulsao febril simples nao requer EEG, neuroimagem ou anticonvulsivante cronico de rotina.","Midazolam 0,2 mg/kg intranasal/bucal/IM (conforme via disponivel) ou lorazepam 0,1 mg/kg IV max 4 mg ou diazepam 0,2-0,5 mg/kg IV/retal conforme protocolo. Repetir uma vez se necessario e preparar segunda linha se status.","Meningite, encefalite, epilepsia, hipoglicemia, hiponatremia, intoxicacao, trauma, crise afebril com febre incidental.",Moderado,"convulsao febril,febre,crise generalizada,meningite,focal,15 minutos,benzodiazepinico,crianca","Crise em andamento >5 min: ABC, oxigenio, glicemia, benzodiazepinico, monitorar respiracao e preparar escalonamento se persistir. Sinais meningeos, focalidade ou alteracao persistente exigem investigacao.","Crise >5 min em andamento, >15 min, focalidade, repeticao em 24h, rigidez de nuca, petequias/purpura, rebaixamento persistente, idade <6 meses, imunossupressao, trauma.","Convulsao complexa, suspeita de SNC/sepsis, estado de mal, recuperacao incompleta, idade atipica, risco social ou foco infeccioso que exige internacao.","Estado de mal epileptico, necessidade de via aerea/ventilacao, crise refrataria, meningite/encefalite grave, instabilidade hemodinamica.","Pedir TC/EEG de rotina na simples, nao procurar meningite quando ha sinais, prescrever anticonvulsivante cronico apos crise simples, prometer que antitermico previne recorrencia.","Simples nao e igual a primeira crise assustadora; classifica por duracao, focalidade e recorrencia. Antitermico melhora conforto, mas nao e profilaxia confiavel.","Crise generalizada <15 min, unica em 24h, crianca recupera bem = convulsao febril simples; investigar febre e orientar.",Convulsao febril simples e benigna; o trabalho e reconhecer complexidade e sinais de infeccao do SNC.,Crise com febre -> crise ativa >5 min? benzodiazepinico -> estabilizou -> classificar simples/complexa -> sinais SNC? investigar -> simples sem alarme: tratar foco febril/orientar.,1. ABC. 2. Tempo de crise. 3. Benzo se >5 min. 4. Glicemia se indicado. 5. Procurar meningite/foco. 6. Classificar e orientar.,"Simples: generalizada, <15 min, unica/24h, neuro normal. Complexa: focal, prolongada ou recorrente. Exames de rotina na simples: nao.",Nao ha score; classificar simples versus complexa e usar sinais de alerta para meningite/sepsis.,Duracao | Focalidade | Numero em 24h | Recuperacao | Idade | Sinais meningeos | Glicemia se indicado | Foco febril | Orientacao familia,"A avaliacao da convulsao febril nao e procurar epilepsia em todo mundo; e separar a crise simples das situacoes que imitam ou complicam: meningite, disturbio metabolico e status epileptico.",AAP simple febrile seizure guideline summary: https://www.aafp.org/afp/2011/0601/p1348 | Surviving Sepsis Campaign Pediatric Guidelines 2026: https://www.sccm.org/clinical-resources/guidelines/guidelines/surviving-sepsis-campaign-international-guidelines-for-the-management-of-sepsis-and-septic-shock-in
